autor,titulo,texto
Cruz e Souza,Quanta vez,"Quanta vez eu fitei essas fronteiras, Horizontes, estrelas, firmamentos, Presa de sonhos e estremecimentos De esperança, nas horas derradeiras!... Ah! meus longínquos arrebatamentos, Amarguras e dores e canseiras, Que vos fostes nas lágrimas ligeiras, Como folhas levadas pelos ventos... Quanta vez, abafando os meus soluços, Como o errado viajor que cai de bruços Sobre a íngreme estrada da agonia, Ensináveis-me a ler a Bíblia santa Desta vida imortal que se levanta Numa alvorada eterna de alegria!"
Cruz e Souza,Ide e pregai,"Vós que tendes as rosas da bonança Enlaçadas na fé mais doce e pura, Ide e pregai, na noite da amargura, O evangelho do amor e da esperança. Toda luz da verdade que se alcança É um reduto de paz firme e segura: Dai dessa paz a toda criatura, Sobre a qual vossa vida já descansa. Espalhai os clarões da vossa crença Na pedregosa estrada dessa imensa Turba de irmãos famintos, torturados! Conduzi a mensagem luminosa Da caridade, lúcida e piedosa, Redentora de todos os pecados."
Cruz e Souza,Caridade,"Caridade é a mão terna e compassiva Que ampara os bons e aos maus ama e perdoa, Misericórdia, a qual para ser boa, De bens paradisíacos se priva. Mão radiosa, que traz a verde oliva Da paz, que acaricia e que abençoa, Voz da eterna verdade que ressoa Por toda a parte, promissora e ativa. A caridade é o símbolo da chave Que abre as portas do céu claro e suave, Das consciências libertas da impureza; É a vibração do espírito divino, Em seu labor fecundo e peregrino, Manifestando as glórias da Beleza!."
Cruz e Souza,Renúncia,"Renuncia a ti mesmo! Renuncia À mundana e efêmera vaidade: Que em ti sintas a dúlcida piedade Que as desgraças alheias alivia. Do homem, esquece a lúrida maldade, Prosseguindo na estrada luzidia. E denodadamente engendra e cria Teu próprio mundo de felicidade! Parte o teu coração em mil fragmentos, Ofertando-os ao mundo que te odeia, Com a bondade mais pródiga e mais pura. Não olvides em meio dos tormentos: – Renunciar em bem da dor alheia, É ter no Além castelos de ventura."
Cruz e Souza,Tudo vaidade,"Na Terra a morte é o trágico resumo De vanglórias, de orgulhos e de raças; Tudo no mundo passa, como passas, Entre as aluviões de cinza e fumo. Todo o sonho carnal vaga sem rumo, Só o diamante do espírito sem jaças Fica indene de todas as desgraças, De que a morte voraz faz seu consumo. Nesse mundo de lutas fratricidas, A vida se alimenta de outras vidas, Num contínuo combate pavoroso; Só a Morte abre a porta das mudanças E concretiza as puras esperanças Nos países seráficos do gozo!"
Cruz e Souza,Ouvi-me,"Ó vós que ides marchando, almas sedentas De paz, de amor, de luz, sob as maiores Desventuras do mundo, sob as dores De misérias, batalhas e tormentas... Também senti as emoções violentas Que palpitam nos peitos sonhadores, E sustentei, varado de amargores, Surdas batalhas, rudes e incruentas. Também vivi as lágrimas obscuras, Iguais às vossas, míseras criaturas, Que tombais nos caminhos sem dizê-las! Exultai, que uma vida eterna e grande, Além da morte, esplêndida se expande No coração sublime das estrelas!..."
Cruz e Souza,Felizes os que têm Deus,"Entre esse mundo de apodrecimento E a vida de alma livre, de alma pura, Ainda se encontra a imensidade escura Das fronteiras de cinza e esquecimento. Só o pensador que sofre e anda à procura Da verdade e da luz no sentimento, Pode guardar esse deslumbramento Da Fé – fonte de mística ventura. Feliz o que tem Deus nessa batalha Da miséria terrena, que estraçalha Todo o anseio de amor ou de bonança!... Venturoso o que vai por entre as dores Atravessando o oceano de amargores, No bergantim sagrado da Esperança."
Cruz e Souza,Glória aos humildes,"Ai da. ambição do mundo, ai da vaidade Que se mergulham sob a noite escura, Noite de dor que além da sepultura Nos afasta da vida e da verdade. Só o caminho divino da humildade Pode ofertar a luz radiosa e pura, Que vem salvar a mísera criatura Confundida no abismo da impiedade. Pobres da Terra, seres infelizes, Cheios de prantos e de cicatrizes, Levantai vosso olhar sereno e forte. Não maldigais a ulceração da algema, E esperai a vitória alta e suprema, Que Jesus vos prepara além da morte."
Cruz e Souza,Aos trabalhadores do Evangelho,"Há uma falange de trabalhadores, Espalhada nas sendas do Infinito, Desde as sombras do mundo amargo e aflito Aos espaços de eternos resplendores. É a caravana de batalhadores Que, no esforço do amor puro e bendito, Rompe algemas de trevas e granito, Aliviando os seres sofredores. Vós que sois, sobre a Terra, os companheiros Dessa falange lúcida de obreiros, Guardai-lhe a sacrossanta claridade; Não vos importe o espinho ingrato e acerbo, Na palavra e nos atos, sede o Verbo De afirmações da Luz e da Verdade."